0007.0379	top 10 quotes of BhagavadGita
0007.0380	strawberry cake
0007.0381	History 2022
0007.0382	Netflix horror series
0007.0383	best education systems in the world
0007.0384	How can I unclog my toilet without a plunger
0007.0385	How to bake a chocolate cake
0007.0386	Can dogs eat almonds
0007.0387	What is the lifespan of Golden Retriever dog
0007.0388	What is ryan goslings newest movie
0007.0389	best tv show of 2021
0007.0390	top gadgets to buy on 2023
0007.0391	is trump running again in 2024
0007.0392	Most effective ideas to support abortion rights
0007.0393	Best age to start saving for retirement
0007.0394	full scholarship for international students
0007.0395	benefits for marathon training
0007.0396	Health  Wellness
0007.0397	How to find the latest political news
0007.0399	Which US presidents were impeached
0007.0400	What is the GDP of state of Alaska
0007.0403	mona lisa
0007.0404	how is the stock market doing today
0007.0406	How old was Princess Diana when she died
0007.0407	black wall street massacre
0007.0410	What are some signs of hypertension
0007.0414	How do you get started with charcoal drawings
0007.0415	French Revolution
0007.0416	The origin of ice hockey
0007.0417	Whats the most expensive painting in the world
0007.0419	How did Heath Ledger die
0007.0423	WEIGHT LIFTING
0007.0424	List all tamil new movies
0007.0426	Best movies 2022
0007.0427	diabetes symptoms
0007.0428	One piece latest episode
0007.0430	biggest malls in the world
0007.0431	myocarditis treatment
0007.0432	what is the holy trinity
0007.0433	Was there a recession in the US in 2008
0007.0434	When was Harvard University founded
0007.0436	How do I get my dog to stop eating its own poop
0007.0437	Effective ways to lower blood sugar
0007.0438	Where can I learn about the amazon forest
0007.0439	what breed of dog lives the longest
0007.0440	top dangerous dog breeds
0007.0441	List of state senators
0007.0442	baby crying every morning
0007.0443	Latest developments in battery technology
0007.0444	best sports to put young children into
0007.0445	DIY crafts for kids
0007.0447	What are the 10 most allergic foods
0007.0448	What is the best yoga posture for a beginner
0007.0449	which is the most stolen food in the world
0007.0450	When did World War I start
0007.0451	what are frequent flyer miles worth
0007.0452	What is the most popular clothing brand for teens
0007.0454	paint by number tips and tricks
0007.0455	pitbull dog
0007.0456	Hard lemonade recipe
0007.0457	which is the cutest dog breed
0007.0458	How to clean silk garments
0007.0459	How many universities are in California
0007.0460	how to solve windows problem
0007.0462	hockey rangers
0007.0463	what is the best dog to get for children
0007.0464	Who first discovered America
0007.0465	Typical life span of black females
0007.0468	Guide to starting a victory garden
0007.0471	Did Disney or DeSantis win the lawsuit
0007.0473	Can parakeets eat dandelions
0007.0474	Whats the worst university in the US
0007.0475	Natural herbs for illness
0007.0481	Best websites to buy bitcoins
0007.0482	Food company stocks
0007.0483	drawing apples
0007.0484	Pets 2022
0007.0485	what is the leader of kenya called
0007.0486	When is Christmas often celebrated
0007.0488	To properly teach my child manners
0007.0489	Which is the fastest growing economy in 2020
0007.0490	Where can I buy bath towels
0007.0491	who is the best president of Brazil
0007.0492	2022 Oscar Winners
0007.0493	The financial reason behind layoff from tech companies
0007.0495	What are good canned goods to stock up on
0007.0496	simple woodworking project
0007.0497	2022 nhl draft
0007.0498	Health  Wellness
0007.0499	History of the periodic table of elements
0007.0500	which star wars trilogy is the best
0008.0001	Air Force Ones
0008.0003	NFL rushing leader
0008.0004	What is the significance of farming in the economy
0008.0006	How many species of birds are there
0008.0007	best tv shows 2022
0008.0008	how to have fun in fortaleza in brazil
0008.0009	fashionable shirt for mens
0008.0010	How long do dachshunds live for
0008.0011	What was first pandemic disease in the history
0008.0012	Pandhya Empire in Tamil Nadu
0008.0013	What is higher studies
0008.0014	president brazil
0008.0015	Who won the popular vote in the 2020 US Presidential Election
0008.0016	ice cream making at home
0008.0018	Who is the first cabinet president in US
0008.0019	What is best place to do shopping in Paris
0008.0020	DRAW THE CAT
0008.0021	PIZZA  TEA
0008.0022	Major Music events in 2022
0008.0023	What pet can adopt in 2022
0008.0024	Creamy White Chili recipe
0008.0025	Top skills needed to be a web developer
0008.0026	Chicken Tikka recipe
0008.0027	financing a car
0008.0028	Countries with lower GDP
0008.0029	Can you convert six feet into centimeters
0008.0031	Ancient Egypt
0008.0032	what are the top 10 museums in the world
0008.0034	What year did World War 2 begin
0008.0036	London apartments
0008.0038	WORLD WAR 1
0008.0041	Which is the best college to pursue medicine in California
0008.0043	good health
0008.0051	rings of Saturn
0008.0052	How many christians are in the US
0008.0053	most hypoallergenic dog breeds
0008.0054	average college fees in india
0008.0055	Who won the super bowl this year
0008.0056	How has the implementation of standardized testing impacted the quality of education in the United States
0008.0058	what to watch on hbo in 2022
0008.0061	baseball modern
0008.0062	pet clinic in Texas
0008.0063	Gadgets should buy on 2022
0008.0064	american football
0008.0066	How raise a kid in now a days world
0008.0067	What team did Walter Payton play for
0008.0068	DRAWING THE CAT
0008.0069	best alcoholic drinks
0008.0070	Dog or Cat which is pet friendly
0008.0071	Which party won most parliament election in India
0008.0072	Top trading partners of United States in 2022
0008.0073	Microsoft stock price predictions
0008.0074	What college has the largest student body
0008.0075	When was World War 2
0008.0076	pro soccer
0008.0078	Hottest planet in our solar system
0008.0079	stock Exchange
0008.0080	What year was CocaCola founded
0008.0083	How to groom my cats nail
0008.0084	How can I make a paper mache statue
0008.0085	How much does a dog trainer cost
0008.0088	Who was the US Vice President in 1985
0008.0089	Cause of world war I
0008.0101	How did the civil war start in usa
0008.0102	how do you replace a door
0008.0103	Broadway shows in New York City
0008.0104	How can i make a milkshake
0008.0105	cat is acting weird solution
0008.0106	sweet recipe
0008.0107	Best python online courses 2022
0008.0108	Martha stewart cooking show
0008.0109	How to change a flat tire
0008.0110	tottenham hotspur
0008.0112	good parks in Suriname
0008.0113	How do you get rid of termites
0008.0114	when was the mighty mac bridge built
0008.0115	pedro alvares cabral
0008.0116	Top Tv shows in United States on 2022
0008.0117	Which dog is very rare in US
0008.0119	COVID 19
0008.0120	How to prevent from memory loss
0008.0121	archery training in portland
0008.0122	FAMILY PROBELM
0008.0123	About Golden Retriever
0008.0124	what are best places to do shopping in New York
0008.0126	When was the big bang
0008.0127	What countries fought in world war 2
0008.0128	What is the tallest animal in the world
0008.0129	how to solve for pi
0008.0130	best way to earn money through Facebook
0008.0132	last elections
0008.0133	Can I feed my rabbit chocolate
0008.0136	Why do apples turn brown when cut and left open in air
0008.0137	How much does a bachelors degree cost
0008.0139	US weapons of WWII
0008.0140	How many dog owners are there in the United States
0008.0148	travel bag
0008.0152	What is a wormhole
0008.0153	How to raise a kid with good behaviours in 2022
0008.0154	best ways to make money in 2020
0008.0155	toddler handling tips
0008.0156	William Wallace
0008.0157	antman actress
0008.0158	indian cuisine in utah
0008.0159	Kennedys in public office
0008.0161	How to get rid of weeds in the garden
0008.0162	lindor mets
0008.0163	How to play ice hockey
0008.0165	How long can maple trees live for
0008.0166	What is best place to do shopping in England
0008.0167	best books to learn Java
0008.0168	FAMILY HOME HOUSE
0008.0169	which party won the most election in the history of America
0008.0170	The science behind magical words
0008.0172	How long should you study for
0008.0175	How many legs does a spider have
0008.0176	best horror movies
0008.0177	Is a duckbilled platypus related to any type of duck species
0008.0179	Which team won the 1999 World Series
0008.0182	How to make my cat drink enough water
0008.0187	Truth behind atom science
0008.0190	d mart
0008.0191	pizza  drink
0008.0193	2022 elections results
0008.0198	American dog breeds
0008.0199	What is the mass of an electron
0008.0200	Which political party has ruled the US for the longest
0008.0201	stop my cat from scratching the carpet
0008.0202	embroidery for beginners
0008.0204	What is the most popular girls clothing store
0008.0205	How is inflation rates calculated
0008.0206	how to make a necklace
0008.0207	how education change a society
0008.0208	What are some effective strategies for promoting positive parentchild relationships
0008.0209	Manchester Utd
0008.0211	Meenakshi temple in Madurai
0008.0212	nba champions
0008.0213	real madrid
0008.0215	where can i buy nike tennis shoes online
0008.0216	What is best place to do shopping in New York
0008.0217	KIDS DRAWING
0008.0218	best grocery stores in united states
0008.0219	bst museums in Denmark
0008.0221	Who won the last cricket world coup in 2011
0008.0222	top spiritual places in the world
0008.0223	how do airplanes fly
0008.0224	About Steve Jobs
0008.0225	woodworking bird houses
0008.0226	What is the closest planet to the Sun
0008.0228	carrot cake
0008.0229	tallest tree in the world
0008.0230	Does Zoroastrianism follow any specific gods or prophets
0008.0231	How to make white rice for sushi
0008.0232	How do I calculate the calories I need in a diet
0008.0234	Is there a vaccine for ebola
0008.0235	ROMAN CATHOLIC
0008.0239	Golden Retriever info
0008.0241	red label
0008.0244	election date
0008.0247	history of america
0008.0249	American presidents
0008.0250	What are some basics for learning pottery
0008.0251	how big is saturn
0008.0252	Federal funds rate history
0008.0253	how is senate different from the house of representative
0008.0254	Colin Powell
0008.0255	cats care
0008.0256	Who was the second president of the Unites States
0008.0257	the best food for fish
0008.0258	best fit trackers
0008.0260	bitcoin future
0008.0261	la liga fixtures
0008.0262	Chola Empire in Tamil Nadu
0008.0263	Which is the dangerous pet to grown in house
0008.0264	spiritual wellbeing class
0008.0265	What are the symptoms of breast cancer
0008.0266	best movie in the year
0008.0267	top national parks in united states
0008.0269	How raise a kid in urban areas
0008.0270	Worlds largest sports facilities
0008.0272	How to raise kid in Texas
0008.0273	Things should you keep away from home
0008.0275	During which war did the attack on Pearl Harbour happen
0008.0278	Is swimming good for an obese male
0008.0281	What grade level should students begin learning algebra
0008.0282	How many seasons of Stranger Things are there
0008.0284	What temperature does salt melt at
0008.0285	How to maintain BMI
0008.0287	American pizza
0008.0288	How do make a gold necklace
0008.0291	Countries with more churches
0008.0292	Labrador Retriever info
0008.0295	How effective were the COVID vaccines at saving lives
0008.0296	2009 elections
0008.0301	How many breeds of dogs are there
0008.0302	food with no fats
0008.0303	most popular religion in the world
0008.0304	Top resistance bands 2022
0008.0305	Newcastle FC
0008.0306	Our Lady of Kibeho
0008.0307	history of yankees
0008.0308	how oxygen is made
0008.0309	Why did the Roman Empire fall
0008.0310	dog shelters in washington
0008.0311	What is the impact of artificial intelligence on science and technology
0008.0312	how to make a phone app
0008.0313	Which drink is the very the oldest in 2022
0008.0314	What are best exercise to feel fresh every morning
0008.0315	What foods are best paired with red wine
0008.0316	world cup list champions
0008.0317	Science behind Turmeric Powder
0008.0318	DRESS WOMEN
0008.0319	How to prevent from breast Cancer
0008.0320	How to raise kid in urban areas
0008.0322	about Pitbull
0008.0323	Shape of DNA
0008.0324	Fight Club ending explained
0008.0325	Top universities in united states
0008.0326	back stretch
0008.0328	feudal japan
0008.0329	who is the father of physics
0008.0330	What year did the Tampa Bay Buccaneers change the design of their uniforms and logos
0008.0332	How to make a martini alcohol drink
0008.0333	US GDP
0008.0334	Who won the Oscar for best actor in 2021
0008.0338	What are protein rich food sources
0008.0343	health foods
0008.0350	What religion is the most practiced in Utah
0008.0351	Who started google
0008.0352	Toys for children 14 years old
0008.0353	How to make necklaces
0008.0354	When did the vietnam war end
0008.0355	college in my 40s
0008.0356	How did the invention and widespread use of the automobile in the early 20th century transform American society
0008.0358	How to teach a girl under age of 10 about good and bad touches
0008.0359	shivaji maharaj death
0008.0360	which team won the last fifa cup
0008.0361	Shopping california
0008.0362	political parties in usa
0008.0363	What are the benefits of doing yoga
0008.0364	NFL super bowl
0008.0365	What is Simple definition of science
0008.0367	What is best place to do shopping in London
0008.0368	Top sports events might visit in 2022
0008.0370	best malls in London
0008.0371	tips to reduce do effective grocery purchase
0008.0372	How to prevent from cancer
0008.0373	Banana Bread recipe
0008.0374	How to create a custom theme in windows 10
0008.0375	President Roosevelt
0008.0377	HTML for beginners
0008.0378	Siamese cat
0008.0379	How many of Taylor Swifts songs have reached number one
0008.0380	Show me recipes for outdoor barbecues
0008.0381	Who was the oldest president of the United States
0008.0382	Why cant babies have honey
0008.0383	Who was the British Prime Minister in 1990
0008.0386	How to make paper pouch
0008.0390	2021 superbowl champion
0008.0394	2009 football match
0008.0398	arts colleges
0008.0399	How many years of schooling does it take to get a law degree
0008.0400	What is the current rate of inflation
0008.0401	List of marvel movies
0008.0402	How is the winner of the world cup of soccer of 2008
0008.0403	most popular sport in croatia
0008.0404	why do cats vomit
0008.0405	How to know if you have diabetes
0008.0406	chocolate ice cream
0008.0408	What was the best art in 2022
0008.0409	recreation ideas for childrens
0008.0410	streetwear shops in Rome
0008.0411	How to renovate a home with forest theme
0008.0412	What was the highest earning movie at the theaters in 2021
0008.0413	dogs races
0008.0414	How old was Abe Lincoln when he was shot
0008.0415	art history
0008.0417	top religions in the world
0008.0418	PETS DAG
0008.0419	tips to prevent ourselves from cancer
0008.0420	what are best places to do shopping in Los Angels
0008.0421	Countries with most GDP in 2022
0008.0422	Typhoid fever symptoms
0008.0423	Who are the most famous graffiti artists
0008.0424	Cheeseburger Soup recipe
0008.0425	University of Texas
0008.0426	Crafts  Hobbies
0008.0427	Who was the US Speaker of the House in 1979
0008.0429	hbo max
0008.0430	best southern usa colleges for people with low income
0008.0431	workout plan for women
0008.0432	universities in the US
0008.0433	What is the capitol of Wyoming
0008.0434	how many wives did henry the eighth have
0008.0436	How do you make a screwdriver drink
0008.0437	kamala haris
0008.0442	What are the benefits of homeschooling
0008.0449	best 5 min crafts
0008.0450	What age do children start kindergarten
0008.0451	canvas painting
0008.0452	How to fix a leaky roof
0008.0453	dance class
0008.0454	Vietnam War
0008.0455	vanilla Ice cream
0008.0456	Where can i buy gucci clothes
0008.0457	When did the American civil war start
0008.0458	what is the most common disease
0008.0461	How to play Kabaddi
0008.0462	what is best place to shopping in newyork
0008.0463	Who is the current Dalai Lama
0008.0464	which species has more number of hearts
0008.0466	What is the history of pandemic
0008.0467	universitys new york
0008.0468	tips to stay motivated and learn effectively
0008.0469	best surfing beaches in california
0008.0470	What are the best hobbies develop in 2022
0008.0471	Best Italian cuisines
0008.0472	DRAW CAT
0008.0473	What is the name of an adult female horse
0008.0474	Best 60 percent mechanical keyboards
0008.0475	indigenous trees in the Sierra Nevada
0008.0477	What companys stock saw the largest percentage increase on the Dow Jones in 2021
0008.0478	how does gravity work
0008.0479	how to make paper wind chime
0008.0481	Whats the strongest wood for a table
0008.0483	Who won the NBA MVP award in 1995
0008.0485	2009 BYELECTION
0008.0486	hiking in PA
0008.0492	tech 2022
0008.0498	Does oil have a boiling point
0008.0499	American league
0008.0500	Can cats eat tomatoes
0009.0001	what is the most popular reptile pet
0009.0002	how to teach a dog not to bother you while eating
0009.0003	When was the Oscars awards started
0009.0004	What role does art play in society
0009.0005	woodworking classes near me
0009.0006	universities with best history program
0009.0007	average salary for professional baseball player
0009.0008	WEST SIDE STORY
0009.0009	2022 IPL winner
0009.0010	Sports 2022
0009.0013	The facts about Neem tree
0009.0014	How many emperors have their been in the history of Japan
0009.0015	world war I
0009.0016	top fruits to eat to gain energy
0009.0017	What is gluten free food
0009.0018	When did the United State of America gain Independence
0009.0019	Things to consider before buy a laptop
0009.0020	Transfiguration of Jesus
0009.0022	best artist in India
0009.0023	chest workouts
0009.0024	What savings accounts have the highest interest rates
0009.0025	About Stephen Hawkings
0009.0026	Mount Fuji Volcano
0009.0027	How many more people prefer vanilla ice cream over chocolate
0009.0028	woodworking bird houses
0009.0031	headache cure tips
0009.0033	healthy foods
0009.0037	hindu temple
0009.0040	Information about Jesus Christ
0009.0043	How to make long island iced tea
0009.0044	how can i charge the battery of my car
0009.0045	smallest dog breed
0009.0046	famous eastern paintings
0009.0047	most popular movies of the 1980s
0009.0048	The Olympics are held every how many years
0009.0049	Who was the Greek God of War
0009.0050	What sport is best known as the king of sports
0009.0051	what is the most popular thing to knit
0009.0052	private colleges in vermont
0009.0053	who discovered oregon
0009.0054	What are the most pressing environmental challenges facing our planet today
0009.0055	Average calorie consumption by weight
0009.0056	caring for motherless kittens
0009.0057	when was the 100 dollar bill introduced
0009.0058	Who is the father of bitcoin
0009.0059	Bayern Munich
0009.0060	How to start sculpting
0009.0061	What causes tornadoes
0009.0062	What happens to our soul after death
0009.0063	US history
0009.0064	The average cost of house in California in 2022
0009.0065	brazil foods
0009.0066	What are some flowers similar to roses
0009.0067	Narendra modi birthdate
0009.0068	Pizza Stone uses
0009.0069	About messi
0009.0071	albert einstein
0009.0072	Best compiler software for Java programming
0009.0073	highest IQ in world
0009.0074	What are the top 10 highest grossing movies in the United States
0009.0075	Is running healthy
0009.0076	How many crappie are estimated to be in Sardis Lake in Mississippi
0009.0077	supreme court
0009.0079	rubiks cube  how to solve
0009.0081	onlie shopping
0009.0082	catholic church
0009.0089	Largest religion in the United States
0009.0090	how can i build a bridge
0009.0091	top 10 movies
0009.0092	What sport is good for the elderly
0009.0093	top ten punk songs
0009.0097	who is the highest paid volleyball player
0009.0098	Average age of first time parents
0009.0099	What impact has the rise of streaming platforms had on the traditional entertainment industry
0009.0100	bill clinton birthplace
0009.0101	what is the square root of 9
0009.0102	who won the nobel prize 1998
0009.0103	THE POWER OF THE DOG
0009.0104	dunes for 4 wheeling
0009.0105	How to make plastic flowers
0009.0107	Whats the meaning of newtons second law
0009.0108	Causes of rust on metal
0009.0109	How do you fix a hole in a shirt
0009.0110	difference between call by reference and call by value in a function
0009.0111	When did Brexit occur
0009.0112	crafts from sticks
0009.0113	Proper Deadlift form
0009.0114	game of the year 2020
0009.0115	Tom cruise film list
0009.0116	Jackie Robinson
0009.0118	how did the life began
0009.0119	toddler milestones
0009.0120	Can cat eat egg
0009.0121	How much cat food should I feed my two year old cat per day
0009.0124	Bitcoin value 2022
0009.0131	How to build arm strength
0009.0135	HISTORY OF AMERICAN INFLATION
0009.0137	how can i be a budist
0009.0138	Autumn craft ideas
0009.0139	vodka drink recipes
0009.0140	best rated playstation four games
0009.0141	What type of food is healthiest for my pet
0009.0142	When was the piece created
0009.0144	What is the worlds largest online retailer
0009.0145	what is the highest grossing animated film
0009.0146	When was Chess invented
0009.0147	What are some popular recreational activities that promote physical fitness
0009.0148	top movies in 2012
0009.0149	causes and symptoms of gastritis
0009.0150	where to buy bikes in philadelphia
0009.0151	atv trails near phoenix
0009.0152	A QUIET PLACE PART II
0009.0153	What is the average interest on a savings account
0009.0154	Best tamil movies in 2022
0009.0155	Which artwork is most expensive in the world
0009.0156	Define Operator Overloading in c
0009.0157	champions league
0009.0159	Improving running speed
0009.0160	How much does PlayStation 5 cost on amazon
0009.0161	top 10 nature spots in India
0009.0162	nike outlet in california
0009.0163	WordPress for beginners
0009.0164	Is it possible to overdose on vitamins
0009.0165	biggest malls Canada
0009.0166	Is chocolate bad for health
0009.0167	The fact behind an apple a day
0009.0168	watercolor paintings
0009.0169	What is the best natural food to feed a hamster
0009.0170	Protein foods
0009.0171	Will manufacturing ever come back to the US
0009.0172	NFL best player
0009.0178	1892 election
0009.0184	The best juice for health
0009.0185	When is it not ok to spank a child
0009.0186	rugby rules
0009.0187	How to carve a pumpkin
0009.0188	cheapest beer
0009.0189	What are the details of the role
0009.0190	How often do you do things for entertainment
0009.0192	What are the key factors influencing the current partisan divide in United States politics
0009.0193	best dog crates
0009.0194	where was Picasso born
0009.0195	Average price of a car by year
0009.0196	Who won the First World War
0009.0197	parks in bucks county pa
0009.0198	history of napoleon achievements
0009.0201	When was nuclear power first utilized
0009.0202	ballparks in california
0009.0203	healthy food
0009.0204	Major political events in 2009
0009.0206	What are the benefits of exercising
0009.0207	syntax of a structure in java
0009.0209	dog care
0009.0210	headache solution
0009.0211	Are Cavalier King Charles spaniels good family dogs
0009.0212	Qatar world cup 2022
0009.0213	I am looking for a XXL polo shirt for under fifty dollars
0009.0214	top 10 dog breeds
0009.0215	Which generic in music has huge number of fans
0009.0216	Importance of investing money
0009.0217	How do I start screenprinting tshirts
0009.0218	geology North America
0009.0219	Best education colleges
0009.0220	Whats the oldest living thing in the world
0009.0221	best dog food
0009.0222	2009 earthquake
0009.0225	apple juice
0009.0232	Greatest American Medalist
0009.0233	how can birds fly
0009.0234	United States Mid term elections 2022
0009.0236	awesome water color paintings
0009.0237	Best food to make for large gatherings
0009.0240	what is politics and its importance
0009.0241	What are some innovative trends in the food and beverage industry
0009.0242	most durable dog toys
0009.0243	what is the oldest religion
0009.0244	beginning buddhism
0009.0245	how long do hamsters live
0009.0247	fastest quarter mile times for stock cars
0009.0249	Top comic characters in marvel movies
0009.0250	best painter of the last decade
0009.0251	nba team with the most championships
0009.0252	italian foods
0009.0254	How hot is lava
0009.0255	Top ways to lose weight
0009.0256	How are black holes formed
0009.0257	Which country worships Shiva
0009.0259	which is the smallest seed in the world
0009.0260	baby crying continuously
0009.0261	Standard Poodle information
0009.0263	Best Cat food
0009.0264	corruption in Brazil
0009.0265	top 10 math genious
0009.0266	How many public schools are there in New York City
0009.0267	Yard mainatenance tips
0009.0268	Can dogs eat eggs
0009.0269	What type of food pairs best with a Moscato wine
0009.0270	dining room furniture
0009.0271	Best gameboy advance games
0009.0272	Paper crafts
0009.0273	How old is the universe
0009.0274	Treaty of Versailles in 1919
0009.0277	organic drinks
0009.0285	Oldest whiskey in the world
0009.0286	how to make pancakes
0009.0287	How to convert to christianity
0009.0289	why is mitch mcconalls face and hands blue
0009.0290	what are the natural products to live healthy
0009.0291	Most expensive pieces of street art sold
0009.0292	what is the most popular cocktail
0009.0293	What are some strategies for maintaining a healthy lifestyle
0009.0294	smoked pork butt recipe
0009.0295	How do bees make honey
0009.0297	modern art gallery seattle
0009.0298	foods safe for diabetic
0009.0299	which team won the first Hockey world cup
0009.0300	Who was the youngest english monarch
0009.0301	Buying groceries on a budget
0009.0302	Capitol issue
0009.0303	List foods with high protein
0009.0304	How to improve sleep
0009.0305	biography of Adolf Hitler
0009.0306	Where are white tail deer found
