0009.0307	simplified bhaskara formula
0009.0308	top shopping sites
0009.0309	Which forest is the largest in the world
0009.0310	how to make omelet
0009.0311	top natural wonders in the world
0009.0312	world cup 2002
0009.0313	At what age should a child begin eating cooked meat
0009.0314	Best stretches before running
0009.0315	Importance of drinking water
0009.0316	What is the leading cause of miscarriage
0009.0317	unusual produce items
0009.0318	What was Monets most famous work
0009.0319	How to make pizza
0009.0320	2021 GOTY
0009.0322	orange juice
0009.0323	Ways to stop period cramps
0009.0331	DNA test effectiveness
0009.0334	black holes
0009.0335	top rated ps4 games
0009.0336	Which sport is good for cardio
0009.0338	Whats the most interesting thing youve read lately
0009.0339	What is the worlds smallest country
0009.0340	When did Van Gogh die
0009.0341	How to potty train my cat
0009.0342	the fire in the louvre
0009.0343	which is the lightest gas
0009.0344	What are the emerging trends in online shopping
0009.0345	best malls near los angeles
0009.0346	most expensive sports venues to build
0009.0347	smoked turkey breast recipe
0009.0348	The history of recession
0009.0349	Inter milan
0009.0350	Sweet alcoholic mixed drinks
0009.0351	How long do you let bread dough rise
0009.0353	urban arts
0009.0354	Best fish to buy for an aquarium
0009.0355	financial crisis 2009
0009.0356	What were some major historical events that occurred in the year 2022
0009.0357	Jesus heals the bleeding woman
0009.0358	The fact behind olive oil
0009.0359	Cuban communist regime
0009.0360	Where did Eskimo dogs originate from
0009.0361	t20 cup winner
0009.0362	What NFL teams have never played in a Super Bowl
0009.0363	space x
0009.0364	top luxuries clothing brands in United States
0009.0365	Is swimming good for health
0009.0366	How many albums has Breaking Benjamin released
0009.0367	cincinnati bengals
0009.0368	How to age gracefully
0009.0369	best movie 2009
0009.0371	home crafts
0009.0378	world war
0009.0380	How often to feed dogs
0009.0382	the best animations of 2015
0009.0383	How many died at the Battle of Bunker Hill
0009.0384	Chris Brown Concerts 2021
0009.0385	Best taco places in LA
0009.0386	camping in canada
0009.0387	biggest oil paintings
0009.0388	How Do I Get My Infant to Sleep
0009.0389	give ideas for solving a problem immediately
0009.0390	how can pet owners contribute to responsible pet ownership
0009.0391	foraging in the pacific northwest
0009.0392	how much water do dogs need a day
0009.0393	Small dog upset stomach causes
0009.0394	AS Roma
0009.0396	iowa womens basketball
0009.0397	what is the study of aviary life called
0009.0398	Mobiles under rs 10000
0009.0399	Best home exercises for beginners
0009.0400	How do I stop my babys tantrums
0009.0401	history of lakers
0009.0402	How many baseball players on each team
0009.0403	who was the president of the United States for the shortest time
0009.0404	Shopping 2022
0009.0405	vegetarian cat food
0009.0406	INTEL or AMD  which is good for gaming
0009.0407	Vietnam War causes
0009.0408	how do black holes work
0009.0410	new york pizza
0009.0411	What is the currency of Mexico
0009.0412	outlet malls canada
0009.0413	What type of roofing material is best at preventing leaks
0009.0414	Tips to keep the home clean
0009.0415	Are French Fries Bad for Health
0009.0417	What foods are cats allergic to
0009.0418	Whats the most popular sculpture in the world
0009.0419	Fastest Animal
0009.0421	sweet home
0009.0426	What presidents are on dollar bills
0009.0430	Best foods in the world
0009.0432	How to identify poison ivy
0009.0435	Best place to buy sneakers
0009.0436	how do I know if its my battery or starter
0009.0437	Which two spices are the most popular in the world
0009.0439	What are 4 examples of recreation
0009.0440	attack on pearl harbor
0009.0441	how long do Alsatian dogs live
0009.0443	Fastest growing cities in the USA
0009.0444	war of 1812
0009.0445	what is the highest grossing superhero movie
0009.0446	what to do when toddler has a tantrum
0009.0447	What are some research initiatives aimed at understanding the effects of climate change
0009.0449	Los Angeles Lakers
0009.0451	Who invented abstract art
0009.0452	When was the movie Troy released
0009.0453	The uses of friend function in C with examples
0009.0454	The dark side of Junk foods
0009.0455	Workforce Participation Calculation
0009.0456	smart home products
0009.0457	class 10 cbse question paper
0009.0458	Current status of lantern bug in USA
0009.0459	Wheatgrass health benefits
0009.0460	best red wine world
0009.0461	new jersey nets
0009.0462	Can you find me the best strawberry shortcake recipes
0009.0463	Does babysitting makes distance between parent and children
0009.0464	Benefits of walking
0009.0465	northern california hiking trails
0009.0466	Why wont Mississippi expand the Medicaid program
0009.0467	Whats the most successful third party ever in US politics
0009.0468	Best ways to build credit
0009.0469	Stroganoff recipes
0009.0474	1998 election results
0009.0480	Longest serving presidents In united states history
0009.0481	most expensive food in the world
0009.0482	how light works
0009.0483	What are the best supplements for better bone health
0009.0484	healthy dog food
0009.0485	List of all the American presidents
0009.0486	what are the best cats
0009.0487	list two political parties in us
0010.0001	fried chicken in new jersey
0010.0002	pottery classes charleston
0010.0003	Which religion is the oldest
0010.0004	Recipe including eggs milk and chocolate
0010.0005	how to make pan cake
0010.0006	What is the best way to finance a new car
0010.0008	Neymar Barcelona
0010.0009	best books to read at leisure hours
0010.0010	what is the vaccine for cat
0010.0011	Shop At Home for every room
0010.0012	making resin jewelry
0010.0013	How to save the nature
0010.0014	How to concentrate presence of mind
0010.0015	Biden administration on tax code policy
0010.0016	Does it snow in Texas
0010.0017	Pet clinics in New York city
0010.0019	kitchen remodeling portland
0010.0020	Places to study medicine in low cost
0010.0021	list top universities in united states
0010.0022	best cocktails
0010.0023	What is the most popular sport in the Middle East
0010.0024	how star dies
0010.0025	What does hydrophilic mean
0010.0027	What led to US involvement in the Vietnam War
0010.0029	best price for HP computer
0010.0032	science day
0010.0034	What style was Monet known for
0010.0035	new home building plans
0010.0037	Where I can see glaciers in the mountain
0010.0038	Which country does not have presidential rule
0010.0039	sprituality is our hope
0010.0040	Function templates in c
0010.0041	Do decks need to be made with wood
0010.0042	How do I bond with my teenage son
0010.0043	What is the 10 most popular sport
0010.0044	Arsenal Henry
0010.0045	best republican presidential candidates
0010.0047	The US senate
0010.0048	2022 New Upcoming movies
0010.0049	When did wine making begin
0010.0051	top economy of the world
0010.0052	california governor polling
0010.0054	what is the best nature place
0010.0055	Where to run code for python language
0010.0056	What is the ways of best hobby
0010.0057	fwrite syntax in c language
0010.0058	First published in 1869 Nature
0010.0059	Pep Guardiola
0010.0060	lacrosse lessons in Connecticut
0010.0061	which type of history topic most liked by people
0010.0063	American football coaches
0010.0064	Best Master degree Courses
0010.0065	Recreation parks in newyork
0010.0066	national league home run leaders
0010.0067	World War II
0010.0068	What are cosmic particles
0010.0069	things to consider before buy a tire for vehicles
0010.0070	What will be the next series in cricket
0010.0071	What is the new atom discovered
0010.0072	Which type of paint should a beginner start with
0010.0074	Explore the best places to eat and drink around the globe
0010.0076	mars rover
0010.0077	What style of art did Gustav Klimt practice
0010.0078	What is the best pet to have
0010.0079	When do ducks fly south
0010.0080	Story behind statue of liberty
0010.0081	Grocery store near Lomita
0010.0082	Which US city has the highest rates of literacy
0010.0083	What is the average lifespan of a grizzly bear
0010.0084	How to watch Tennis
0010.0086	youth soccer league salem
0010.0087	who is the greatest artist of the world
0010.0089	best quotes from Shawshank  redemption movies
0010.0090	what is most popular palyer  in the cricket
0010.0092	Trump Bolsonaro
0010.0093	Which recreation movie is mostly liked by people
0010.0094	online interior design degrees
0010.0095	Reduce fat from body
0010.0096	What is the weather in New York
0010.0097	is it good to consume carbonated drinks routinely
0010.0098	current polling georgia senate
0010.0099	What are the benefits of constructing a home on a slab foundation
0010.0100	Which pets behave smoothly with people
0010.0101	Barcelona Messi
0010.0102	how to protect the nature
0010.0103	Important file handling functions in c
0010.0104	New York City schools offer many health services
0010.0106	who was the Buddha
0010.0107	How does a top stay upright while spinning
0010.0108	Where is the uranium prepared heavily
0010.0109	About Statue of Liberty
0010.0110	normal blood pressure female
0010.0111	What is the elemental composition of Jupiter
0010.0112	Who won the NBA title in 2003
0010.0113	butcher shops in seattle
0010.0114	What will be the upcoming series for Tennis
0010.0115	Leonardo da Vinci
0010.0116	who is a good parent
0010.0117	my game is football
0010.0118	history of america
0010.0119	Watermelon smoothie recipes
0010.0120	Where to get pure gold across the globe
0010.0121	What are top 10 pets
0010.0122	The current American president
0010.0123	Manual testing or automation which have more scope
0010.0124	beginner microscope for kids
0010.0125	pacific crest trail maps
0010.0126	What political party is John Roberts part of
0010.0127	What is a SPAC
0010.0129	Give me thriller movie in Tamil
0010.0130	shopping tips to save money
0010.0132	upcycling jeans
0010.0133	is the universe infinite
0010.0134	How to control blood pressure through food intake
0010.0135	Browse Google Shopping
0010.0136	College near New York
0010.0137	Used clothes purchase
0010.0138	American GDP
0010.0139	dog parks in santa monica
0010.0140	What fish are easiest to care for in a saltwater aquarium
0010.0142	movie locations
0010.0143	Best deals to grab at amazon during  Christmas
0010.0144	How to stay healthy
0010.0147	Who is the best batsmen in Australian team for cricket
0010.0148	What are the 4 pillars of education
0010.0149	Hack Gmail
0010.0150	List of dog breeds
