0004.0192	how medicines are made
0004.0193	Which university is the best in the world
0004.0194	Top 10 dogs who bite
0004.0195	What is Paleo diet
0004.0196	how to change oil
0004.0197	Whos the president of Russia
0004.0198	Recipe for mulligatawny soup
0004.0199	Who is Banksy
0004.0201	Which of todays countries is the oldest
0004.0202	What are the most common dog breeds to have as pets
0004.0203	Who is the longest reigning English monarch
0004.0204	war of 1812
0004.0206	How long should people workout everyday
0004.0207	Who was elected President of the USA in 2016
0004.0209	spring indoor decoration ideas
0004.0210	best ski resorts in the united states
0004.0211	Tips for a better Parenting
0004.0212	world war
0004.0213	antioxidants in common fruits
0004.0214	local forest restrictions
0004.0216	who painted the scream
0004.0218	What can vegans eat
0004.0219	History of the Real Madrid soccer club in Spain
0004.0220	Most popular horses
0004.0221	How many calories does a 20 minute HIIT workout burn
0004.0222	median income in missouri
0004.0224	What supplies do you need to start knitting
0004.0225	Which party will be in leading role of upcoming presidential election
0004.0226	what sport is popular in guatemala
0004.0227	Things to know before taking plant based foods
0004.0228	What star is the closet star to Earth besides our sun
0004.0229	northern california engineering schools
0004.0230	What is the youngest element on the periodic table
0004.0231	World War I
0004.0232	ron Paul
0004.0233	how tall do oak trees get
0004.0234	How many people in America did not graduate from college
0004.0235	corgi facts
0004.0236	What are the most valuable football clubs in the world
0004.0237	what about the inflation rate in United States on 2022
0004.0238	What species of shrub are native to southern California
0004.0239	paper maiche
0004.0240	Who is governor of Florida
0004.0241	mediation for athiests
0004.0244	steelers super bowl wins
0004.0245	What items do I need to knit a scarf
0004.0246	Who discovered Brazil
0004.0247	How does the rain process occur
0004.0248	Hummus recipe
0004.0249	famous art shows in the world
0004.0250	2020 presidential election result
0004.0254	tips to live healthier
0004.0256	What is the heaviest bird that exists today
0004.0257	tips for a better parenting
0004.0258	northern california hiking trails
0004.0259	How many grand slams are there a year in tennis
0004.0262	How many years to become a veterinarian
0004.0263	What are some essential woodworking tools
0004.0264	what is the best college major
0004.0265	Real Madrid
0004.0266	What was the top box office movie in 2021
0004.0267	Tips to repair home
0004.0269	what are the non canonical books of the bible
0004.0270	who painted the mona lisa
0004.0271	stone material high cooling rates
0004.0272	worlds largest political party
0004.0273	Whats the biggest species of dog
0004.0274	How does the aurora borealis appear
0004.0275	Who is the current speaker of the house in the US
0004.0276	Where did the chicken KFC come from
0004.0277	Is Biden going to run for president again
0004.0278	What causes thunder and lightning
0004.0279	How many terms can a United States president serve
0004.0280	how to adopt a puppy
0004.0281	Playstation 4 Pro
0004.0282	How old is Drew Barrymore
0004.0284	how to remove a tick from my child
0004.0285	How are black holes formed
0004.0286	Is climate change is real
0004.0287	Does the Russia Ukraine war causes Recession among worldwide
0005.0001	how do I make a margarita
0005.0002	boston art museums
0005.0003	what country has the best education
0005.0004	current senators Pennsylvania
0005.0005	What are things to do first for home garden
0005.0006	What teams played in the NFL 2021 superbowl
0005.0007	What is the most watched sport in America
0005.0008	How to remove ink from hand
0005.0009	Who was Jesus Christ
0005.0010	top humidifiers in 2022
0005.0011	Swimming how to learn
0005.0012	Unemployment rate in United states in 2021
0005.0014	What are the best breeds of dogs for families with children
0005.0015	hiking trails in Oregon
0005.0017	Is it on average cheaper to buy things online or in store
0005.0018	italian cuisine
0005.0019	best online site for shopping
0005.0025	What is deconstruction
0005.0026	At what age should parents talk to their children about sex
0005.0027	why does my cat stare at me
0005.0028	where did kenny pickett go to college
0005.0029	How do you freeze water into ice quicker than putting it in a freezer
0005.0030	average heart rate of healthy adult woman
0005.0031	college costs in state California
0005.0032	desert hikes oregon
0005.0033	How do I stop groundhogs from entering my yard
0005.0034	What is the longest river in the world
0005.0035	andy warhol paintings for sale
0005.0036	What is a recipe for Thanksgiving
0005.0037	beef lasagna recipe
0005.0038	What is the soccer team with the most world cup titles
0005.0039	Chelsea FC
0005.0040	Who won the 2000 Super Bowl
0005.0041	who would be the next president of United States
0005.0042	Can dogs live with cats
0005.0044	Is climate change is real
0005.0045	What is the background of the fifth president of the United States
0005.0046	What do cats eat
0005.0047	What are the benefits of spending time in nature
0005.0048	weight loss methods
0005.0051	tell something about shopping
0005.0052	Top restaurant in United States
0005.0056	Best horror movies of all time
0005.0057	What year was the first presidential election of the united states
0005.0058	What are the best water parks in the world
0005.0060	Highest mountain in the world
0005.0062	essential tools for making cupcakes
0005.0063	Where is Rio de Janeiro located
0005.0065	What are the rules for raquetball
0005.0066	how many types of beer are there
0005.0067	the science behind positive energy on words
0005.0068	indian cuisine
0005.0069	top grocery shops in United States
0005.0071	When did picasso die
0005.0072	What is the cost of going to the average Ivy League school including room and board
0005.0073	How to train a puppy to sit
0005.0074	Who painted gioconda
0005.0076	Is PHP outdated
0005.0077	Food  Drink
0005.0080	What is the best form of cardio for fat loss
0005.0081	best charter schools houston
0005.0083	Who was the 13th president of the United States
0005.0084	can cats eat bread
0005.0085	is covid vaccines causes side effects
0005.0087	how to calculate square root
0005.0088	Who was the first woman in space
0005.0089	What was the highest final score in an NBA game
0005.0090	How to restore a computer
0005.0091	Tips to avoid cardiac issues
0005.0093	How to prepare negroni cocktail
0005.0097	What are some popular national parks to visit in the United States
0005.0098	How much in gear does the average Hockey player wear
0005.0100	Cosmopolitan recipe
0005.0101	List the top ten countries with highest GDP rate
0005.0106	Who won the most MVPs in the NBA
0005.0107	foods with omega 3
0005.0108	What is the best morning energy drink
0005.0109	How many calories do I burn running 1 hour
0005.0110	gluten free pizza recipe
0005.0111	Can cats drink milk
0005.0114	good stocks to buy in 2022
0005.0115	How much food should a cat eat each day
0005.0116	art museum cincinnati
0005.0117	How much does a black bear weigh
0005.0118	At what age is it okay to start leaving kids alone for short time at home
0005.0120	who won the Kentucky Derby last year
0005.0121	interesting facts about cats
0005.0122	What is the name of Bob Dylans first album
0005.0125	Is china hiding the origin of Covid
0005.0126	coffee maker
0005.0127	Who burned rome
0005.0128	What are the benefits of pursuing higher education
0005.0129	When does a baby start teething
0005.0131	Who won the 1978 Stanley Cup
0005.0132	Best actors in 2022
0005.0135	who is the governor of south dakota
0005.0136	How fast does a nascar go
0005.0138	Average temperature for April in North America
0005.0139	usd to euro
0005.0140	treating cat uti
0005.0141	How many US adult have a high school diploma
0005.0142	how to play badmitton
0005.0143	top programming languages need to know to get a job
0005.0145	10 best comedy movies of 2022
0005.0146	what about the peoples thought over Gun control in the United States
0005.0150	love seat
0005.0151	Highest selling recording artist of all time
0005.0152	What are some affordable and stylish home decor ideas
0005.0153	Games for dogs
0005.0154	How do you feel when you wake up
0005.0156	queen bee iifespan
0005.0159	Who created the pizza
0005.0162	nfl draft location
0005.0165	History of Formula one race
0005.0166	What is the most expensive coffee bean
0005.0168	What is the most common pet in America
0005.0170	do athletes live longer
0005.0171	Best horror movie of 2022
0005.0172	Best university in Massachusetts
0005.0173	Colors of golden retriever
0005.0174	top movies in world wide on 2008
0005.0175	What is the tallest species of tree
0005.0176	Jeremy Renner
0005.0177	meditation techniques
0005.0178	Who is the president of the united states
0005.0179	How to get kids to eat veggies
0005.0180	What is the best way to clear stone tiles in the back yard
0005.0181	What are some famous paintings by Vincent van Gogh
0005.0184	best dog collar
0005.0185	How do tsunamis form
0005.0187	What actor has starred in the most films ever
0005.0190	knitting for beginners
0005.0192	How many seasons is Friends
0005.0193	Which IDE is better to learn c programming language
0005.0194	Coldest place in the world
0005.0195	what was the first religion
0005.0196	What are the benefits of living near a national park
0005.0197	Pasta alla carbonara recipe
0005.0198	How much does it cost to get into crafts with clay
0005.0199	How to care for a puppy
0005.0200	origin of the universe
0005.0201	Who wrote the book of Genesis in the Bible
0005.0203	How to start running
0005.0204	Things to learn from the movie Shawshank redemption
0005.0207	fig varieties in the US
0005.0208	where did tom brady go to college
0005.0210	finance a home
0005.0211	cat care
0005.0212	the best car to by in 2022
0005.0214	List of upcoming Marvel Movies
0005.0215	Is Donald Trump left or right
0005.0217	Can dogs eat candy
0005.0218	What are the spiritual benefits of meditation
0005.0220	Joe Biden
0005.0221	Tips for Healthy foods
0005.0222	How to make pizza dough
0005.0223	Which actor has the most Best actor nominations
0005.0225	At what age should you spay or neuter a cat
0005.0226	list some cute pets
0005.0229	Top Diet plans for women
0005.0230	greyhound adoption
0005.0233	What is the most common pet in the United States
0005.0234	Liverpool FC
0005.0235	president election 2024
0005.0237	NBA championship 2009
0005.0238	popular cocktails
0005.0239	What was the first film with sound
0005.0240	which dog breed is smartest
0005.0242	Robert F Kennedy
0005.0244	facts about dogs loyalty
0005.0245	road map to become a backend developer
0005.0246	What are the benefits of using renewable energy sources
0005.0247	Canada best natural places
0005.0249	How often to change furnace filter
0005.0250	Can a non US citizen ever run for the presidency
0005.0251	How do salmon spawn in the wild
0005.0253	What are some effective ways to discipline children
0005.0254	Best books to read in 2008
0006.0001	MLB standings
0006.0002	How to install TV on the wall
0006.0003	What are some fall decorating tips
0006.0004	What is the difference between Christians and Catholics
0006.0005	best schools for teens in france
0006.0006	Learn how to knit
0006.0007	top online retails for shopping
0006.0008	Who won the 2016 presidential election
0006.0009	Interest rate and less money
0006.0010	Most popular sport in the uk
0006.0012	How much is the PS5
0006.0013	What year was Pluto discovered
0006.0014	How far is the earth from the sun
0006.0015	Can I grow snake as a pet
0006.0016	Best energy drink sugarfree
0006.0017	learning guided meditation
0006.0018	Where can I buy an air fryer
0006.0019	What are best exercise for legs
0006.0020	Can dogs eat eggs
0006.0022	Top universities in United States
0006.0023	Why do I need to spay my pets
0006.0024	how do you tie a slip knot
0006.0025	What is the worlds largest religion
0006.0026	How to fix a broken stair
0006.0027	How big do German Shepherds get
0006.0028	most popular degree in australia
0006.0030	how to make child learn good things
0006.0032	What is the best camera for a beginner in photography
0006.0033	At what age should a dog be spayed
0006.0034	top movies of Morgan freeman
0006.0035	How to remove stains from clothes
0006.0037	How do you fold a paper airplane
0006.0038	quilt store montana
0006.0039	Chocolate chip cookie recipe
0006.0041	How to make room smell fresh and nice
0006.0042	What is a gravity assist
0006.0043	What are the symptoms of Diabetes
0006.0044	Where is Japan located
0006.0045	Skills to learn to become a Software Engineer
0006.0046	most points scored in an NFL game
0006.0047	What is the most popular cat breed in US
0006.0048	Life after death
0006.0050	Who was the most liked President in America
0006.0051	Who is Andrew Yang
0006.0052	What is the longest running TV show
0006.0053	Junk foods with examples
0006.0054	Can cat eat egg
0006.0055	best burger in texas
0006.0056	Who is the best painter in India
0006.0057	Reds tickets
0006.0058	How to remove paint from clothes
0006.0059	Who was the second president of the United States
0006.0060	Who is Tipu sultan
0006.0061	box office 1992
0006.0062	what are seven wonders of world
0006.0063	What elements are most abundant on Mars
0006.0064	Best drink to go with sushi
0006.0065	spank kids good bad
0006.0066	What is the best way to stop a baby from crying
0006.0067	What is the best dogs breed to have in home
0006.0068	How many members of congress are there
0006.0069	basics of HTML programming
0006.0070	What are the main factors that affect interest rates in an economy
0006.0071	Best horror movie 2022
0006.0072	How to train a dog
0006.0073	What are the most prestigious Universities in America
0006.0074	bitcoin price
0006.0075	Road map to become a Software Engineer
0006.0076	The childhood story of Hitler
0006.0077	How many people died in the Civil War
0006.0078	best aquarium for a turtle
0006.0079	Who is Rajnikanth
0006.0080	How do I make a martini
0006.0081	How many world cups has Brazil
0006.0082	appalachian hiking trails
0006.0083	What are the holy places in the world
0006.0084	What are the best colleges in New York
0006.0085	what causes sunset colors
0006.0086	Tell us a little about Barcelona FC soccer club
0006.0087	top smartwatches in 2022
0006.0089	How to make sushi
0007.0001	Most expensive colleges in USA
0007.0002	martin luther king speeches
0007.0004	obama trump
0007.0005	Which director has won the most Oscars
0007.0006	brazil president
0007.0007	How many species of birds have been identified
0007.0009	Wolves FC
0007.0011	history of pele
0007.0012	fastest animal in the world
0007.0014	How to renovate a home with African theme
0007.0015	What was the outcome of the 2022 midterm elections
0007.0018	How long does an evergreen tree live on average
0007.0019	When are estimated tax payments due to the IRS
0007.0020	How often does Hobby Lobby switch their 50 sale categories
0007.0021	IPL points table
0007.0022	BEST FOOD FOR DINNER
0007.0023	How expensive is raising a child
0007.0025	Buffalo Bills
0007.0029	Spaghetti recipe
0007.0030	Ingredients for making Icecream
0007.0031	Best penny stocks to buy
0007.0032	Things to do on beach vacation
0007.0033	Arts 2022
0007.0034	Kid Nike Black Shoes
0007.0035	best place to buy tank tops
0007.0036	What is the most popular dog breed in the United States
0007.0037	Can cats eat watermelon
0007.0038	Can Cats drink milk
0007.0039	new heavy metal bands
0007.0040	What religions were persecuted in World War II
0007.0041	Top chain restaurants in america
0007.0042	best places to visit in highlands NC
0007.0043	arsenal last match
0007.0045	Current good shortages and solutions
0007.0046	best handmade gifts for teacher
0007.0047	Which countries supported Hitler during world war 2
0007.0049	CAT FOODS
0007.0050	healthy diet for pet parakeets
0007.0051	starting felting
0007.0052	is energy drink bad
0007.0053	who will run against Biden 2024
0007.0054	Remove a computer virus
0007.0055	HOW TO MAKE AN ICED TEA
0007.0056	What were the long lasting impacts of the great depression
0007.0057	history of brazil
0007.0059	How long does a corgi live
0007.0061	Poodle dog
0007.0062	are fish oil supplements really good for heart health
0007.0064	Which country has the highest percentage of college graduates
0007.0065	At what age can children begin learning to cook
0007.0067	history leonardo da vinci
0007.0070	How much of the world is covered in forests
0007.0071	How much does a fully grown female Great Dane weigh
0007.0072	What was 1800s Austrias official currency
0007.0074	Who will be USA president in 2024
0007.0075	Best cryptos 2022
0007.0078	In which country were the September 11 attacks
0007.0079	chicken burger
0007.0081	donald trump meme
0007.0082	fix a kitchen faucet
0007.0083	How to upgrade Windows XP to Windows 7
0007.0084	Common health problems of German shephard
0007.0085	Spirituality and Healing
0007.0086	Hurricane Disasters
0007.0087	discovery of America
0007.0088	gentle parenting breaking up sibling fights
0007.0089	What is the difference between NASDAQ and the SP 500
0007.0090	what is 4 plus 5
0007.0091	Where can I buy lawn darts in Canada
0007.0092	What are some of the most critically acclaimed films of all time
0007.0093	How to stop my cat from shedding
0007.0094	commute cosy apartment in Texas
0007.0095	largest mammals in the world
0007.0096	What can Biden improve on
0007.0097	Which animals are the most popular to have as pets
0007.0098	hitler family list
0007.0099	phoenix coyotes current arena
0007.0100	What is the best way to stream entertainment news
0007.0101	dog shih tzu
0007.0102	What are the most valuable companies in the world
0007.0105	What is the cheapest Ipad
0007.0106	Signs of a heart attack
0007.0107	What is the difference between a stock and mutual fund
0007.0112	what is an atom
0007.0114	What is the speed of the average running back in the NFL
0007.0116	Recreation snow
0007.0118	Are bees insects
0007.0119	At what age is more than 2 hours of screentime approved by the AAP
0007.0123	Iphone 13
0007.0124	Which countries have banned female genital mutilation
0007.0125	Gym tips for beginners
0007.0129	Premier league manager of the year 2022
0007.0130	Who is the current president of the united states
0007.0131	pizza and pasta
0007.0132	Natural weight lose remedies
0007.0133	Was Julius Caesar a king
0007.0134	What are the best beachfront hotels in Naples Florida
0007.0135	who was the first leader of canada
0007.0137	What type of food should I feed my parrot
0007.0138	How do you build a bird house
0007.0140	When will the Oak Ridge Boys have their next tour
0007.0142	Gun control law
0007.0143	Best exotic pets
0007.0144	What do Canada Geese eat
0007.0145	most popular actor for action movies
0007.0146	netflix action movies
0007.0147	How to have a home birth in 2022
0007.0148	Why do planets rotate counterclockwise
0007.0149	product baby
0007.0152	Entertainment 2022
0007.0153	How much does it take to begin stock investing
0007.0154	How do you make banana bread
0007.0156	Who are cholas
0007.0157	who is virat kohli
0007.0159	what is the best art museum to visit in New York City
0007.0160	What is the most common dog breed in the US
0007.0164	best workout
0007.0168	Who nominates judges to state courts
0007.0169	Is a dolphin a mammal
0007.0170	Why is soda dangerous to your health
0007.0171	When is the next World Cup for womens soccer
0007.0172	BACHELOUR DEGREE
0007.0173	Who was the first famous female scientist
0007.0175	north carolina hiking trails
0007.0178	Mathematics pythagorean theorem
0007.0179	History of Communism in India
0007.0180	ferret adoption
0007.0181	What to eat and drink when you have a cold
0007.0182	how to make bonsai
0007.0183	How tall is Mount Everest
0007.0184	most dangerous sport
0007.0185	what are the different moves in volleyball called
0007.0187	what are the advantages of doing Yoga
0007.0188	What is Justin Trudeaus policy
0007.0189	how do you unclog a sink
0007.0190	best painter of the last decade
0007.0191	Wonders of world
0007.0193	Current developments in the US Ukraine and Russia situation
0007.0194	Easy margarita recipe
0007.0195	Best exercises for overweight dogs
0007.0196	who is leading the premier league
0007.0199	Which Religion Is the Oldest
0007.0200	How to cook pasta the Italian way
0007.0201	average home price in texas
0007.0202	When was the 25th star added to the flag
0007.0203	what is the best yoga positions for hip pain
0007.0205	What age do babies start teething
0007.0207	Yorkshire Dog
0007.0208	What is the average distance between the Earth and sun
0007.0211	What is the average cost of a private school education in the US
0007.0213	history of baseball
0007.0217	What are some ways to get healthier skin
0007.0220	How much lower is the gravity on the moon compared to Earth
0007.0221	Amazon Alexa is worth it
0007.0222	BEST WORKOUT TODAY
0007.0225	blueberry smoothie
0007.0226	Dan Quayle
0007.0227	Thor Love and Thunder release date
0007.0228	forest fires
0007.0230	Home 2022
0007.0231	What are main reasons for climate change
0007.0233	Best clothing site for toddlers
0007.0234	is pluto a planet
0007.0235	What is the bulge that the Battle of the Bulge takes its name from
0007.0236	popsicle stick birdhouse
0007.0237	How do I restring a guitar
0007.0238	What was the highest grossing film in 2021
0007.0239	Best US National Parks
0007.0241	is climate change real
0007.0242	How many scientists have come out against AI
0007.0243	Ideas to expand education funding levels
0007.0244	What education does someone need to become a doctor
0007.0246	afghanistan history of war
0007.0247	Love theme
0007.0248	Which species of bird has the largest eggs
0007.0249	Line dancing near Houston TX
0007.0250	Temples in United States
0007.0251	teach me how to pray
0007.0252	history of US budget imbalance
0007.0253	How much does it cost to get a bachelors in teaching
0007.0254	donald trump
0007.0256	show coldplay
0007.0260	How many works have been attributed to Banksy
0007.0261	Who were the main countries in World War I
0007.0262	Lhasa Apso dog
0007.0264	Does metformin really slow the aging process
0007.0265	best healthy foods
0007.0268	Help me figure out what dark matter is made of
0007.0269	top action movies of the year
0007.0270	What year did Shakespeare die
0007.0272	The largest animal in the world
0007.0273	NATURAL BODYWASHER
0007.0275	NFL last results
0007.0277	Hungarian goulash
0007.0278	What are operators in C programming language
0007.0279	parenting tips
0007.0280	Education 2022
0007.0281	the first prime minister in the UK
0007.0282	how to start homeschooling kindergarten
0007.0283	Exhibition paintings by Michelangelo
0007.0284	How long did brett favre play football
0007.0285	Difference between a Caucasian shepherd and German shepherd
0007.0286	Criminal investigation of Donald Trump
0007.0287	Fun crafts to do with popsicle sticks
0007.0288	who won the first cricket world cup
0007.0289	What is the best estimate for how many trees are in the Amazon rainforest
0007.0290	Is diet soda bad for your health
0007.0291	life and work of Vincent van Gogh
0007.0292	History of America
0007.0293	Best ways to boost the US economy
0007.0294	Which American universities are the best to attend
0007.0295	investment for dummies
0007.0296	benefits of covid19 vaccine
0007.0297	Best Food  Drink in Metro Detroit area
0007.0298	What are some of the strange varieties of cheese around the world
0007.0299	What are the entry requirements for med school in the US
0007.0300	which species of bird lays the largest eggs
0007.0301	what sports pays athletes the most
0007.0303	best places africa nature
0007.0304	natural headache remedies
0007.0305	how to lower blood pressure naturally
0007.0307	list of oscar winning American actress
0007.0311	How old was Julius Caesar when he died
0007.0312	How many national parks are in the US
0007.0313	what is 4 multiplied by 4
0007.0316	dangers of combining bleach and ammonia
0007.0317	When did the Wilhelm Gustloff sink
0007.0318	What is the average cost for a new couch
0007.0320	What was the highest grossing movie in 2018
0007.0323	Who was the first US president
0007.0325	What substance are nails made of
0007.0326	mortgage rates
0007.0327	best plants
0007.0329	Which team has won the most FIFA World Cups
0007.0330	Politics 2022
0007.0331	what are the benefits of swimming
0007.0332	best mexican food in ohio
0007.0333	what is ariana grandes real name
0007.0334	who was the first US president
0007.0335	What NFL running back ran for the most yards in a single Super Bowl
0007.0336	What kind of vitamins are the best for men aged 40
0007.0337	What is the most famous typical dish of Brazilian cuisine
0007.0338	Biggest basketball arenas in the United States
0007.0339	president Joe Biden
0007.0340	Programming languages should learn in 2023
0007.0341	Is the popularity of Ron Desantis declining in Florida
0007.0342	How do I know if I am liberal or conservative
0007.0344	Best money making ideas today
0007.0345	current premier of manitoba
0007.0347	best parenting books for new parents
0007.0349	what is the most expensive work of art
0007.0350	PEPSI 750 ML PRICE IN INDIA
0007.0351	when was coca cola invented
0007.0352	How much alcohol is too much for you
0007.0354	What phylum do humans belong to
0007.0358	What is the right temperature to cook chicken at
0007.0359	How do pet microchips work
0007.0360	Marvel movies with female heroines
0007.0362	How many mass shootings occurred in 2009
0007.0366	What birds are known to make nests inside the Saguaro cactus
0007.0367	Which flower blooms every seven years
0007.0369	BEST  FOOD FOR BREAKFAST
0007.0370	What was the biggest election landslide in US history
0007.0371	Slumdog Millionaire movie
0007.0373	In which country were there pharaohs
0007.0375	One plus mobiles in flipkart
0007.0376	SECOND WORLD WAR
0007.0378	Civil War
