0001.0001	Who can introduce new bills
0001.0002	Taylor Swift concert dates
0001.0003	history of Russia
0001.0004	What a 1 year old baby can eat
0001.0005	What caused the 2008 financial collapse
0001.0006	pickle salsa recipe
0001.0007	Signs to get your kid evaluated for autism
0001.0008	Where can I find the best prices on a new Macbook Pro laptop
0001.0009	What is the significance of the battle of Stalingrad
0001.0010	How to potty train a 2 year old
0001.0012	what is the best deals of 2022
0001.0013	Has a woman ever been Prime Minister of Canada
0001.0014	who won the stanley cup in 2021
0001.0015	how big is grand canyon
0001.0016	Is Yellowjackets coming back to Showtime for season 2
0001.0017	what are the longest living animals
0001.0018	Governor Jerry Brown
0001.0019	When was the first test flight of the space shuttle
0001.0020	How to potty train a pitbull
0001.0021	where can i adopt a pet near me
0001.0023	top environmental etfs
0001.0024	what are the largest online retailers
0001.0025	How to get rid of pimples
0001.0026	best supplements for body building
0001.0027	What is the difference between spirituality and religion
0001.0028	what is a cheap hobby i can pick up
0001.0029	How many years of school does it take to become a doctor
0001.0030	where the first atom bomb was droped
0001.0031	who is the best soccer player
0001.0033	what beliefs do methodists hold
0001.0034	What are the highest caloric foods
0001.0035	How to teach your child manners
0001.0036	What are some effective ways to manage stress and anxiety
0001.0037	Who manufactured the Apollo Lunar Module
0001.0038	How do you make beef stew in a crock pot
0001.0039	best movies of the last decade
0001.0040	When was San Diego first settled
0001.0042	How often should I bathe a dog
0001.0043	What is the oldest fossil known
0001.0044	alpacas for pets
0001.0045	How to potty train your toddler
0001.0046	What is torque in physics
0001.0048	what is the most expensive painting in the world
0001.0049	impressionist paintings of reptiles
0001.0050	What are some popular art movements throughout history
0001.0051	what is bill of rights
0001.0052	What species were lost to extinction in 2022
0001.0056	Best flea and tick prevention for dogs
0001.0057	best art school to attend
0001.0058	What breeds make the best service dogs for people who are deaf
0001.0059	Best way to learn programming
0001.0061	How many Stanley Cups have the Montreal Canadiens won
0001.0062	What are some biggest shopping malls in usa
0001.0063	what exotic pets are legal in california
0001.0064	NBA standings for 2020
0001.0065	The best places to in germany to visit
0001.0066	Why is my refrigerator making a squeaking sound
0001.0067	how many agnostics in the us
0001.0069	what are some good products to buy
0001.0070	How to reach inner peace
0001.0071	how to make mojito at home
0001.0072	covid concerns about forests
0001.0073	Vitamins for hair growth
0001.0074	northern california hiking trails
0001.0077	How to potty train your dog
0001.0078	Should I spank my child
0001.0079	What started the first world war
0001.0080	How long is the term of a US senator
0001.0081	usd to euro
0001.0082	what american sports teams has the most world titles
0001.0083	What is the cost of tuition at kent state
0001.0084	What is the current unemployment rate in the United States
0001.0085	Is it healthy to consume fish and milk together
0001.0086	What can I use instead of magnets to keep cabinets closed
0001.0087	What is the name of the last painting done by Van Gogh
0001.0088	What are some of the benefits of spending time in nature
0001.0089	what are black holes made of
0001.0090	What is the best hotel in italy
0001.0091	can a dog be vegan
0001.0092	Give me directions from New York to Los Angeles
0001.0093	what causes warts
0001.0094	How many dogs are in the USA
0001.0095	How many earths could fit inside the sun
0001.0096	Do I need a prescription for Zyrtec
0001.0097	What degrees to become a college professor
0001.0099	What is the best brand of 3D printer
0001.0101	bitcoin predictions
0001.0102	how many calories do people need a day
0001.0103	What is the best stocks to by in 2022
0001.0105	fresh produce
0001.0106	The air in my house is too dry
0001.0107	What kind of educational toys should be given to children of age 38
0001.0108	When did the Roman Empire fall
0001.0110	What are some popular DIY doityourself crafts and hobbies that people enjoy
0001.0111	Homemade macaroni and cheese recipe
0001.0112	How many religions are there in the world
0001.0113	how many years of school are needed to become a doctor
0001.0114	How is osteoporosis in women treated
0001.0116	What is the formula for compound interest
0001.0117	geology North America
0001.0118	How many times does 9 go into 99
0001.0120	What are some effective study techniques for improving memory retention
0001.0121	Austin kearns
0001.0123	How can i fix my TV
0001.0124	What movies is Clint Eastwood known for
0001.0125	How many seats did the Republicans gain in the House in November 2022
0001.0126	Will DMT open your third eye
0001.0127	Is adapalene or retinol better for treating acne
0001.0128	how many calories in a banana
0001.0130	What are some common symptoms of anxiety
0001.0131	right wing party in the usa
0001.0132	What is the worlds oldest religion
0001.0136	What should be the ideal inflation rate for usa
0001.0137	Napoleonic Wars
0001.0138	Best water filter for my house
0001.0139	How to learn to paint
0001.0140	what is a quark
0001.0141	2021 MLB standings
0001.0142	How large is an American football field
0001.0143	What is the largest online car parts store
0001.0144	golf in florida
0001.0145	what are some good movies from 2022
0001.0148	gerrymandered districts in 2020
0001.0149	What are some major events that happened in the 20th century
0001.0150	How to paint a wall
0001.0153	is ebola virus completely eradicated
0001.0154	What is the most expensive art in 2022
0001.0155	How to meditate
0001.0156	Average price for a home in san jose
0001.0157	Womens Converse Chuck Taylors in pink
0001.0158	uv blocking patio umbrellas
0001.0159	Which movie franchise has had the most sequels
0001.0160	What are some lowmaintenance pets that are good for people with busy lifestyles
0001.0161	Adam Dunn
0001.0162	When was Neptune discovered
0001.0163	mortgage tiny home
0001.0164	what is a cheesecake made up of
0001.0166	What are the most common pet dog breeds
0001.0167	how to clean cats ears
0001.0168	How do I keep wasps out of my yard
0001.0169	What are some of the key factors that can affect the stock market
0001.0172	How scientists are able to detect black holes
0001.0173	historical wars ukraine
0001.0174	what is the best age to begin potty training
0001.0175	What was the most important breakthrough science project of 2022
0001.0176	what is a left wing extremist
0001.0177	best indoor house plants
0001.0178	What are the rules for playing badminton
0001.0179	What are some popular hiking trails in the United States
0001.0180	cheapest hobbies to start
0001.0182	meditation ayurveda
0001.0183	What are the largest organized religions in the world
0001.0184	What causes a rainbow
0001.0185	dollar bill origami how to
0001.0186	how to build a cat house
0001.0188	What is the yield curve
0001.0189	How can I repair my garage door opener
0001.0190	What are some popular running shoes for women
0001.0192	mountains in Colorado to climb
0001.0194	woodworking bird houses
0001.0195	What is the largerst tree in the world
0001.0196	best hiking in northern virginia
0001.0198	Who is the longest serving US senator
0001.0199	best scientific invention
0001.0200	What are some effective home remedies for a sore throat
0002.0001	What NBA team has the highest payroll
0002.0003	how to invest in brazil
0002.0005	Most popular dog breeds
0002.0006	how to get reluctant readers to read more
0002.0007	south africa election results
0002.0008	Sean Casey
0002.0010	biggest waterfall
0002.0011	What started world war 2
0002.0012	What are the most important things to teach children in school
0002.0014	usd to euro rate
0002.0015	stainless steel side by side refrigerator
0002.0016	Who was don pedro II
0002.0017	Where to buy a puppy
0002.0018	local dog trainer
0002.0019	amusement parks in michigan
0002.0020	ways to lower a1c
0002.0021	how many calories are in a pizza
0002.0023	best food in brazil
0002.0024	how to get rid of stains in ceramic sink
0002.0025	Adam Dunn
0002.0026	how to clear house of negative energy
0002.0027	Who owns Fox tv
0002.0028	arizona scenic hiking trails
0002.0029	List the countries with top GDP
0002.0030	what do hamster eat
0002.0033	How to teach a 4 year old
0002.0034	cosmopolitan recipe
0002.0035	What is the American dollar to Canadian dollar exchange rate
0002.0037	local pottery classes
0002.0038	best black and white classic movies
0002.0039	Top US movies in 2022
0002.0040	all time win leader in the nba
0002.0041	what is the most popular sport in germany
0002.0042	bulldog adoption centers
0002.0043	What are the most important events in history
0002.0044	Terrible twos
0002.0045	List of the smartest dogs
0002.0046	Right in  party in brazil
0002.0048	turn 100 dollars into 100000 dollars
0002.0049	local craft supply stores
0002.0050	invasive plant species florida
0002.0051	what trading cards are the most valuable
0002.0052	Top ski resorts in the US
0002.0053	back to school supplies january
0002.0054	Reds opening day
0002.0055	passive income
0002.0056	What is the best crypto to buy in 2022
0002.0059	What are some of the most popular sports in the world
0002.0060	budgeting tips for single moms
0002.0061	How much freshwater exists on earth
0002.0062	Bitcoin exchange
0002.0064	what can i do during a rainy day
0002.0065	Best soccer team in brazil
0002.0066	weekend box office numbers
0002.0067	Tet Offensive
0002.0068	Can we travel faster than the speed of light
0002.0069	spicy chili recipe
0002.0070	why do dogs howl when hear sirens
0002.0073	what are the most common college degrees
0002.0074	baskin robbins menu items
0002.0075	best apertifs
0002.0076	pet toys
0002.0077	purses for men
0002.0078	Elsa from Frozen arts and crafts tutorial
0002.0079	american sushi
0002.0081	what is the name of the science that focuses on marine life
0002.0082	cuisinart appliances rustic design
0002.0083	stamp collecting tips
0002.0084	What is the best volleyball team in the world
0002.0085	Catholic THeology
0002.0086	cat trees
0002.0087	Best place to relax with jungle views
0002.0088	local cheesemonger
0002.0089	Best movie in 2021
0002.0090	The top movies everyone should watch in their lifetime
0002.0091	What political party has more house members
0002.0093	amazon forest deforestation risks
0002.0095	Top 10 dogs who bite
0002.0096	list of countries by gdp
0002.0097	How can i prevent problems in my back
0002.0098	What are some of the best ways to improve your health and wellness
0002.0099	help with oil change at home
0002.0100	Why does a cat purr
0003.0001	Who won the superbowl
0003.0002	front clip dog harness
0003.0003	Are cryptocurrencies a safe investment
0003.0006	How to discipline kids under 10 years old
0003.0007	Best animes of 2022
0003.0008	amazon black friday deals
0003.0009	which is the number one basketball in the world
0003.0010	Why is Alexander is called the great General
0003.0011	What is the diameter of an NBA basketball
0003.0012	why do leaves turn color in autumn
0003.0013	elk antlers dog
0003.0014	top 10 countries with highest median income
0003.0015	what kind of wet cat food is the most nutrional
0003.0016	easy stir fry recipes
0003.0017	What grade is a 10 year old in
0003.0018	when was the second world war started
0003.0019	What is the best smartphone on the market in 2022
0003.0020	how to make roast duck chines style
0003.0021	how to knit a sweater
0003.0022	penny stock advice
0003.0023	dog parks new jersey
0003.0024	What do you fo for a sick cat
0003.0025	top 10 countries with highest GDP
0003.0027	Which molecule is most abundant in Earths atmosphere
0003.0028	How much does it cost to start boxing
0003.0029	What beer is most popular in united states
0003.0030	What are the longest rivers in the world
0003.0032	Who is the most famous artiest
0003.0033	Best unknown films
0003.0035	how far is earth from the sun
0003.0036	What a dog can eat
0003.0037	rib tips recipe
0003.0039	What is the Planck theory
0003.0040	how frequently should i bath my dog
0003.0041	What prompted the start of the First World War
0003.0042	What is an electron
0003.0043	easy pasta recipes
0003.0045	list of national parks in US
0003.0046	How many hours of sleep is recommended
0003.0047	how many elements are there
0003.0048	How much a 4 year old can run
0003.0049	What is the speed of light
0003.0050	who started the world war one
0003.0051	Which dog breeds are hypoallergenic
0003.0052	How long did it take to build the pyramids
0003.0053	celebrity weddings
0003.0054	best bully sticks for dogs
0003.0055	How to build a boat
0003.0056	which team has won the most number of fifa cups
0003.0057	oldest senator
0003.0058	Who has won most NFL superbowls
0003.0059	How do I get seasonings to stick to my croutons
0003.0060	what is the first civilization in the world
0003.0061	What is a good messfree craftf for a two year old
0003.0062	who won the 2021 super bowl
0003.0063	How many movies has adam sandler starred in
0003.0064	How many different animals are there over the world
0003.0067	2022 oscar
0003.0068	Best parks in brazil
0003.0069	How to prepare home for winter
0003.0070	Who is babe Ruth
0003.0071	How many different breeds of dogs are there
0003.0073	What is the term of a US congressperson
0003.0074	stonewall riot
0003.0076	Who scored most points in NBA history
0003.0077	Good teaching tools for a 9 year old
0003.0078	What is the best morning excercise
0003.0079	Who created art
0003.0080	aldi weekly ads
0003.0081	What is the largest department store in America
0003.0082	Which species of tree is the tallest
0003.0083	nhl teams pennsylvania
0003.0084	weight loss plans
0003.0085	What are the best games of 2022
0003.0086	Who was the speaker of the house in 2020
0003.0087	what is the most popular dog breed
0003.0089	Who is first president
0003.0090	chicago mayor election
0003.0091	How do I replace a toilet
0003.0093	disposable litter box
0003.0094	feed toddler for snack at 2
0003.0095	what is best platform to shop branded cloths
0003.0096	what is the highest rated movie of 2010
0003.0097	How much water should you drink a day
0003.0098	Most mystery movies to watch
0003.0099	lebron james sneakers
0003.0100	Who is princess isabel of brazil
0003.0101	How do you reduce screen time
0003.0102	what is the pH level of drinking water
0003.0103	What is the city with the highest population
0003.0104	beer can chicken recipe
0003.0105	Whats the most abundant tree type in North America
0003.0107	usnews university ranking
0003.0108	How to make beef wellington
0003.0109	is it okay to get a cat and a dog
0003.0110	Best bike in 2022
0003.0111	Which MLB pitcher has the most career strikeouts
0003.0112	new tv shows
0003.0113	trout stream upstate new york
0003.0114	Beijing Olympic games
0003.0115	How often does a dog need to get a rabies shot
0003.0116	execices for a 15 year old
0003.0117	Running vs sprinting
0003.0119	which food has the low calorie and good for diet
0003.0120	What is best food for dogs to eat
0003.0121	Which Canadian retailer has the lowest prices for electronics
0003.0122	Wheres the biggest volcano located
0003.0123	ways to stop tantrum
0003.0125	local hot springs
0003.0126	smoked brisket recipe
0003.0127	Who is Jair Bolsonaro
0003.0128	What is the optimal salinity for a salt water aquarium with clownfish
0003.0129	nike air force sneakers
0003.0130	What is newtons laws of motion
0003.0131	What are signs of a stroke
0003.0132	deep fried turkey recipe
0003.0133	How much should you exercise each week
0003.0134	when was pablo picasso born
0003.0136	baby and me classes
0003.0137	Which teams are considered The Original 6 in the NHL
0003.0138	2008 Olympics games
0003.0139	How to make a old fashion
0003.0140	How to make lawn neat and clean
0003.0141	how tall is the eiffel tower
0003.0142	When did the US enter WW1
0003.0143	What is the name of the tallest grass on earth
0003.0144	Best high protein foods
0003.0145	Is chocolate good with wine
0003.0146	nonalcoholic beverage that tastes alcoholic
0003.0147	Who were the most famous artists during the Renaissance
0003.0148	What is the dirtiest river in the world
0003.0149	local painting classes
0003.0150	chicago pizza recipe
0003.0151	Pennsylvania governor
0003.0153	who is the highest paid baseball player
0003.0154	What are the signs a roof needs to be replaced
0003.0155	Should I continue education after school
0003.0156	smartest dogs
0003.0157	Who are the candidates in 2024 presidential election
0003.0159	what are the best way to reduced fat
0003.0160	How to make health juice with chemicals
0003.0161	how big is the sun
0003.0162	mens basketball ap rankings
0003.0163	best food for dog weight loss
0003.0164	what is the speed of light in normal words
0003.0165	How many movies has Adam Sandler been in
0003.0166	Right in opostion in china
0003.0167	What is a 401K
0003.0168	How often should you get a massage
0003.0171	Which country has the largest rain forest
0003.0172	How many stradivarius violins are there in existence
0003.0173	best dog toys
0003.0174	What is the best car deals of 2022
0003.0175	best cardboard cat scratcher
0003.0176	What is the largest mammal
0003.0177	Best price comparison website
0003.0178	When was first basketball match played
0003.0179	ideal sleep hours
0003.0180	What do Golden Retrievers like for food
0003.0181	private colleges in philadelphia
0003.0182	most expensive painting in the world
0003.0183	when did world war two end
0003.0185	Which football team has won the most Superbowls
0003.0186	What age should I move out
0003.0187	how to do yoga in the morning
0003.0188	What is recipe  for good turkey chicken
0003.0189	Who is richest person in America
0003.0190	How big is the sun
0003.0191	Which university has the highest undergraduate enrollment
0003.0192	how much do black bears weigh
0003.0193	Who won WWII
0003.0194	current president of France
0003.0195	local waterfalls
0003.0196	waterfront parks pennsylvania
0003.0198	which movie has won the more number of Oscar awards
0003.0199	alpacas for pets
0003.0200	Who are the best painters in the world
0004.0001	Which movie has won the most Oscar wins in one year
0004.0002	Which US president lived the longest
0004.0003	Which country has the highest GDP
0004.0004	bitcoin price
0004.0005	ways to decorate front porch
0004.0006	What foods have high amounts of phosphate
0004.0007	What are the most common religions in Africa
0004.0008	how do i fix a broken picture frame
0004.0009	tips to stay healthy
0004.0010	Iphone 11
0004.0011	Who is the current Premier of Ontario
0004.0012	kneehigh boots
0004.0013	toughest dog balls for heavy chewers
0004.0014	indian chicken curry
0004.0015	swing states 2024
0004.0016	What does it mean to be considered liberal
0004.0017	smoked bbq chicken recipe
0004.0018	Where can I buy groceries for cheap
0004.0019	Can dogs drink milk
0004.0020	Will there be a recession in the US in 2023
0004.0021	Where is the Mona Lisa
0004.0023	How many colors are in the rainbow
0004.0024	best business schools in US
0004.0025	Is garlic safe for dogs
0004.0026	What foods are cats allergic to
0004.0027	what sounds does a deer make
0004.0030	how to raise a 3 year old
0004.0031	moon milk recipes
0004.0032	What is the lifespan of a honey bee
0004.0033	What is the average life span increase for someone who exercises three times a week
0004.0034	how to knit a scarf
0004.0037	Iphone 12
0004.0038	Can tarot cards really predict the future
0004.0039	what religions accept gay marriage
0004.0040	List the top restaurant in United States
0004.0041	how many forms of chemistry are there
0004.0042	How to feed a baby squirrel
0004.0043	What was GDP in the US last year
0004.0044	summer movies 2023
0004.0045	best magnet school san francisco
0004.0046	marvel iron man movie
0004.0047	What evidence exists of the Big Bang Theory
0004.0048	Why is coca cola formula secret
0004.0049	how to train a dog at home
0004.0050	Best state parks in Massachusetts
0004.0051	Who won the most recent Chicago mayor election
0004.0052	What is the best material for a retaining wall
0004.0053	Is John Mulaney still married
0004.0054	Real Madrid CF
0004.0055	how to learn mosaic making
0004.0056	tips to maintain and repair home
0004.0057	What are the latest advancements in gene editing technology
0004.0058	Tips to keep pets away from diseases
0004.0059	How many maximum years can someone serve in congress
0004.0060	Champions League
0004.0061	How do clouds form
0004.0063	ethereum price
0004.0064	At what age should a child begin speaking
0004.0065	is recession making a big impact on worldwide tradings
0004.0066	when did the french revolution begin
0004.0067	wildflowers in michigan
0004.0068	What are the causes of a recession
0004.0069	best drink to pair with cheesecake
0004.0070	how to growth our health
0004.0071	How to make a paper boat
0004.0072	What is soda made of
0004.0073	who painted the scream
0004.0074	biggest economy in the world
0004.0075	How to instill discipline as a parent
0004.0076	dog trainer austin texas
0004.0077	learn to code free course
0004.0078	Why does Switzerland have one of the best education rates
0004.0079	What are the healthiest dog food brands
0004.0080	Which country won the 2018 World Cup
0004.0081	how to make eggnog recipe
0004.0082	What are the open hours of Saguaro National Park East
0004.0083	When did WW2 end
0004.0084	When did the Great Depression end
0004.0087	What are the potential impacts of climate change on biodiversity and ecosystems
0004.0088	Who won the oscar for best actor in 2021
0004.0089	How many leaves does a tree have
0004.0090	What is the most common stone used for sculpture
0004.0091	What is the most common recreational activity across different countries
0004.0092	Golden State Warriors
0004.0093	What is the most practiced religion
0004.0094	rainy day activities for kids
0004.0098	List of upcoming Marvel Movies
0004.0099	best leakproof diapers
0004.0100	watermelon mocktail recipe
0004.0101	what are some tasty nonalcoholic cocktails
0004.0102	When was Rome first sacked
0004.0103	bbq pork shoulder recipe
0004.0104	History and bibliography of the Milan soccer team in Italy
0004.0105	Can i make Starbucks Ice Latte at home
0004.0106	Why do so many people die while mountaineering in the Andes in Chile
0004.0107	Whos Justin Biebers wife
0004.0108	Which online savings account has the best interest rate
0004.0109	Most popular cat breed
0004.0111	how to change your tire
0004.0112	What is the smoothest coffee I can buy
0004.0113	what is the latest album from metallica
0004.0114	top smartwatches brands in United States
0004.0115	top upcoming hollywood movies
0004.0116	How long do dogs usually live
0004.0117	cat trees
0004.0118	Who invented peanut butter
0004.0119	Average home price in las vegas nevada
0004.0120	Most popular dog breed in the us
0004.0121	What is the rate of change of the number of trees on earth for the last 100 years
0004.0123	World Cup
0004.0124	What is the orbital period of the moon around Earth
0004.0125	fitness trails in northern virginia
0004.0126	best dash cam back up camera combo
0004.0127	What are the biggest football teams in Spain
0004.0128	Tell us a little about LioneL Messis story
0004.0129	best dog beds
0004.0130	Do any countries not have mandatory secondary education
0004.0131	alabama white sauce recipe
0004.0132	biggest spiritual leader in the world
0004.0133	Which NBA team plays in Milwaukee
0004.0134	Does the Gila woodpecker only live inside sagauros
0004.0135	How much do horses cost
0004.0136	how to build a pc
0004.0137	what sport did Kobe Bryant play
0004.0138	where can i find salomon x ultra shoes
0004.0139	Is Kombucha alcoholic
0004.0140	plant based foods are healthier or not
0004.0141	Lasagna recipes
0004.0142	What are the benefits of a magnesium supplement
0004.0143	Is Wuhan laboratory is the origin of Covid
0004.0144	What is the most popular cocktail
0004.0145	What types of food are most people allergic to
0004.0146	Which president has gotten the biggest percentage share of the popular vote
0004.0147	What is the NASDAQ
0004.0149	What is the average amount of credit card debt
0004.0150	Barcelona FC
0004.0151	dog with skin allergies how to cure
0004.0152	which party would dominate in the upcoming president election of United States
0004.0153	basketball records
0004.0154	national parks
0004.0155	How did Japan come about
0004.0156	learning activities for 4 year old
0004.0157	current grocery store coupons
0004.0158	jackson pollock date of birth
0004.0160	Burger King fast food chain history
0004.0161	What plants are toxic to cats
0004.0162	Nancy Mace on abortion
0004.0163	When was macaroni and cheese invented
0004.0164	what sport did maria sharapova play
0004.0166	Is there a term limit for the California state governor
0004.0167	lump on my cat after vaccine
0004.0168	Is covid vaccine creates mutation
0004.0170	Which NFL team has lost the most Super Bowls
0004.0171	Does China helps Russia in war crime against Ukraine
0004.0172	Donald Trump
0004.0173	What is the average cost of a college education in the US
0004.0174	What is the biggest shopping mall in America
0004.0175	how to help your child make friends
0004.0176	big bang
0004.0177	top mobiles in 2022
0004.0179	history of nuclear energy
0004.0180	What team won the Stanley Cup in the 202122 season
0004.0181	What is Quentin Tarantinos highest grossing film
0004.0182	Who won the Battle of Waterloo
0004.0183	gun control legislation
0004.0184	When did the Naruto anime come out
0004.0185	What is world politics short note
0004.0186	How old is the universe
0004.0187	who discovered california
0004.0188	How is pepsi made
0004.0189	best horror movies 2021
0004.0190	beginning watercolor faq
